[
  {
    "id": "example-state-court-name-change-guide",
    "schema_version": "1.0.0",
    "record_version": "0.1.0",
    "last_modified": "2026-08-20",
    "title": "Example State Court Name Change Guide",
    "status": "proposed",
    "description": "Sample metadata record for an official court self-help guide related to adult name change.",
    "source_type": "official_self_help",
    "url": "https://example.org/courts/self-help/name-change",
    "jurisdiction": {
      "country": "United States",
      "state": "Example State",
      "locality": null,
      "court": "Example State Courts",
      "agency": null
    },
    "authority": {
      "level": "official_secondary",
      "issuing_body": "Example State Courts",
      "is_source_of_truth": false,
      "authority_notes": "Sample official self-help source. This is placeholder data and should not be treated as an approved real source."
    },
    "dates": {
      "published": null,
      "effective_from": null,
      "effective_through": null,
      "last_updated": null,
      "last_verified": null
    },
    "provenance": {
      "source_content_version": null,
      "content_hash": null,
      "superseded_by_source_id": null,
      "provenance_notes": "Placeholder source; no captured source content."
    },
    "access": {
      "is_free": true,
      "requires_login": false,
      "format": "html",
      "access_notes": "Sample source record using an example URL."
    },
    "rights": {
      "reuse_status": "unknown",
      "license": null,
      "terms_url": null,
      "rights_notes": "Reuse status unknown because this is placeholder sample data."
    },
    "review": {
      "status": "proposed",
      "reviewed_by": null,
      "reviewer_role": null,
      "review_scope": [],
      "reviewed_on": null,
      "reviewed_record_version": null,
      "review_notes": "Sample only. Not approved for production use."
    },
    "workflow_fit": {
      "topics": [
        "name_change",
        "court_self_help"
      ],
      "workflow_ids": [
        "name_change_information"
      ],
      "risk_level": "medium",
      "limitations": [
        "Does not provide legal advice.",
        "Does not calculate filing deadlines.",
        "Does not replace review of current court instructions."
      ],
      "not_for": [
        "deadline_calculation",
        "case_strategy",
        "emergency_legal_help"
      ]
    },
    "citation": {
      "preferred_citation": "Example State Courts, Name Change Guide",
      "retrieved_at": null,
      "archive_url": null
    },
    "notes": "This sample demonstrates how Pro-One can describe an official self-help source before it is approved."
  },
  {
    "id": "example-city-small-business-license-guide",
    "schema_version": "1.0.0",
    "record_version": "0.1.0",
    "last_modified": "2026-08-20",
    "title": "Example City Small Business License Guide",
    "status": "proposed",
    "description": "Sample metadata record for an agency guidance page related to small business licensing.",
    "source_type": "agency_guidance",
    "url": "https://example.org/business/licenses",
    "jurisdiction": {
      "country": "United States",
      "state": "Example State",
      "locality": "Example City",
      "court": null,
      "agency": "Example City Business Office"
    },
    "authority": {
      "level": "official_secondary",
      "issuing_body": "Example City Business Office",
      "is_source_of_truth": false,
      "authority_notes": "Sample agency guidance source. This is placeholder data and should not be treated as an approved real source."
    },
    "dates": {
      "published": null,
      "effective_from": null,
      "effective_through": null,
      "last_updated": null,
      "last_verified": null
    },
    "provenance": {
      "source_content_version": null,
      "content_hash": null,
      "superseded_by_source_id": null,
      "provenance_notes": "Placeholder source; no captured source content."
    },
    "access": {
      "is_free": true,
      "requires_login": false,
      "format": "html",
      "access_notes": "Sample source record using an example URL."
    },
    "rights": {
      "reuse_status": "unknown",
      "license": null,
      "terms_url": null,
      "rights_notes": "Reuse status unknown because this is placeholder sample data."
    },
    "review": {
      "status": "proposed",
      "reviewed_by": null,
      "reviewer_role": null,
      "review_scope": [],
      "reviewed_on": null,
      "reviewed_record_version": null,
      "review_notes": "Sample only. Not approved for production use."
    },
    "workflow_fit": {
      "topics": [
        "small_business",
        "business_license"
      ],
      "workflow_ids": [
        "small_business_license_information"
      ],
      "risk_level": "medium",
      "limitations": [
        "Does not provide tax advice.",
        "Does not determine whether a business is legally compliant.",
        "Does not replace review of current city or agency instructions."
      ],
      "not_for": [
        "tax_advice",
        "regulatory_compliance_opinion",
        "case_strategy"
      ]
    },
    "citation": {
      "preferred_citation": "Example City Business Office, Small Business License Guide",
      "retrieved_at": null,
      "archive_url": null
    },
    "notes": "This sample demonstrates how Pro-One can describe a local small-business source before it is approved."
  },
  {
    "id": "example-state-civil-discovery-rules",
    "schema_version": "1.0.0",
    "record_version": "0.1.0",
    "last_modified": "2026-08-20",
    "title": "Example State Civil Discovery Rules",
    "status": "proposed",
    "description": "Placeholder metadata for example state civil discovery rules; this is not real legal authority or legal guidance.",
    "source_type": "court_rule",
    "url": "https://example.org/courts/rules/civil-discovery",
    "jurisdiction": {
      "country": "United States",
      "state": "Example State",
      "locality": null,
      "court": "Example State Courts",
      "agency": null,
      "jurisdiction_notes": "Fictional jurisdiction used only to demonstrate record relationships."
    },
    "authority": {
      "level": "official_primary",
      "issuing_body": "Example State Courts",
      "is_source_of_truth": false,
      "authority_notes": "Placeholder classification only; the example URL does not establish authority."
    },
    "dates": {
      "published": null,
      "effective_from": null,
      "effective_through": null,
      "last_updated": null,
      "last_verified": null
    },
    "provenance": {
      "source_content_version": null,
      "content_hash": null,
      "superseded_by_source_id": null,
      "provenance_notes": "Placeholder source; no source content was captured."
    },
    "access": {
      "is_free": true,
      "requires_login": false,
      "format": "html",
      "access_notes": "Sample source record using an example URL."
    },
    "rights": {
      "reuse_status": "unknown",
      "license": null,
      "terms_url": null,
      "rights_notes": "Reuse status unknown because this is placeholder sample data."
    },
    "review": {
      "status": "proposed",
      "reviewed_by": null,
      "reviewer_role": null,
      "review_scope": [],
      "reviewed_on": null,
      "reviewed_record_version": null,
      "review_notes": "Placeholder source record only. Not approved for supported use."
    },
    "workflow_fit": {
      "topics": [
        "civil_discovery",
        "interrogatories",
        "document_requests",
        "requests_for_admission"
      ],
      "workflow_ids": [
        "civil_discovery_information"
      ],
      "risk_level": "high",
      "limitations": [
        "Placeholder record only.",
        "Must be replaced with current, verifiable authority before supported use."
      ],
      "not_for": [
        "supported_user_facing_use",
        "final_deadline_calculation"
      ]
    },
    "citation": {
      "preferred_citation": "Example State Civil Discovery Rules",
      "retrieved_at": null,
      "archive_url": null
    },
    "notes": "Placeholder sample data. Not legal guidance."
  },
  {
    "id": "example-state-trial-court-discovery-guide",
    "schema_version": "1.0.0",
    "record_version": "0.1.0",
    "last_modified": "2026-08-20",
    "title": "Example State Trial Court Discovery Guide",
    "status": "proposed",
    "description": "Placeholder metadata for example state trial court discovery guide; this is not real legal authority or legal guidance.",
    "source_type": "court_instruction",
    "url": "https://example.org/courts/guides/discovery",
    "jurisdiction": {
      "country": "United States",
      "state": "Example State",
      "locality": null,
      "court": "Example State Trial Court",
      "agency": null,
      "jurisdiction_notes": "Fictional jurisdiction used only to demonstrate record relationships."
    },
    "authority": {
      "level": "official_secondary",
      "issuing_body": "Example State Trial Court",
      "is_source_of_truth": false,
      "authority_notes": "Placeholder classification only; the example URL does not establish authority."
    },
    "dates": {
      "published": null,
      "effective_from": null,
      "effective_through": null,
      "last_updated": null,
      "last_verified": null
    },
    "provenance": {
      "source_content_version": null,
      "content_hash": null,
      "superseded_by_source_id": null,
      "provenance_notes": "Placeholder source; no source content was captured."
    },
    "access": {
      "is_free": true,
      "requires_login": false,
      "format": "html",
      "access_notes": "Sample source record using an example URL."
    },
    "rights": {
      "reuse_status": "unknown",
      "license": null,
      "terms_url": null,
      "rights_notes": "Reuse status unknown because this is placeholder sample data."
    },
    "review": {